prefecture_id, prefecture_name, prefecture_hash, area_id, prefecture_comment1, prefecture_comment2, prefecture_tree, prefecture_flower, prefecture_bird
01, 北海道, 06372523c61d9cda410a826a016c46d860038dcdc214fe227373af8d6a4a2d98, 01, 江戸時代からの歴史はさることながら、四季折々の風景も楽しめる五稜郭公園。春は星形の城郭を囲むようにソメイヨシノが咲き誇り、冬はイルミネーションが公園を彩ります。その美しい五角形は、上空から見るのがおすすめ。丘珠＝函館線の機内から見える様子は圧巻です。, 札幌のご当地グルメとして、一躍有名になったスープカレー。同じお店でも辛さやトッピングを選んで異なる味を楽しむことができたり、お店によって入れる具材が違うのも魅力です。ぜひ、現地でお気に入りの味をみつけてくださいね。, エゾマツ, ハマナス, タンチョウ
02, 青森県, f4bfa2f65de8ea16a9e314d87c3df78f7de143230ab78c40193952963f38574c, 01, 東京よりも少し遅く、ゴールデンウィークごろに桜の開花を迎える弘前公園。お住まいの地域によっては、年に2回のお花見を楽しめるかもしれません。約2600本のソメイヨシノが咲き誇る弘前公園では、満開の時期はもちろん、桜が散り始めたころにお濠がピンク色に染まる様子もまた美しいですよ。, 「せんべい汁」とは、野菜とお肉を煮込んだ汁にせんべいをちぎって入れる郷土料理です。始めはサクサク、煮込めばモチモチになる食感が特徴で、青森では、家庭ごとに「わが家の味」があります。, ヒバ, リンゴの花, ハクチョウ
03, 岩手県, c28b950d4732ed0ef79db7eaab79938458d25db69fc0c9452338f0dc7108af23, 01, 盛岡駅前の開運橋から見える岩手山と北上川の景色は、岩手出身の私の自慢の風景です。雲がない日は青空と岩手山とのコントラストが美しく、その間を流れる北上川を見ると心が洗われるようです。春はチューリップや芝桜が川辺に咲き乱れ、一層美しく感じます。, 「わんこそば」は、「盛岡冷麺」「盛岡じゃじゃ麺」と並ぶ、盛岡三大麺のひとつです。「どんどん！じゃんじゃん！」といった掛け声で給仕役の方が一口大のそばをお椀に入れ、自分でお椀に蓋を閉めるまで食べ続けるのがルールです。どんどん追加されるそばは、用意されている様々な薬味と共に食べることができますので、飽きずにおいしくいただけます。, ナンブアカマツ, キリ, キジ
04, 宮城県, 810c1142baa4cf861c81a05a5585f404bdf6718b778855f17109f5a0fee2b13a, 01, 街中に豪華絢爛な笹飾りが揺れ動く仙台七夕まつりは、仙台が1年で最も華やぐイベントです。仙台で過ごした小さいころ、メイン商店街の迫力ある七夕飾りの間をかき分けながら進んでいき、カラフルな夢の世界にいるような心地だったのが、いまも印象に残っています。, 枝豆をすりつぶしてペースト状にした「ずんだ」は、絶妙な甘さとまろやかな食感、そして爽やかな色合いが食欲を誘う名物です。最近はシェイクなどにもアレンジされ、多様な味を楽しめるようになってきましたが、私の一押しはお餅と一緒に食べるシンプルな「ずんだもち」です。, ケヤキ, ミヤギノハギ, ガン
05, 秋田県, 15fa1576fc12ec4806c13f47fd309282c87085e7ae8be411b95f6bd00aba0127, 01, 磯釣りで人気のある岩礁地帯の、男鹿半島・潮瀬崎。人の背丈を超えるサイズの岩があちこちに散らばっています。そのなかのひとつがゴジラ岩。名前の通り、海に向かってゴジラが火を噴いているような姿は迫力満点です。ゴジラのシルエットがくっきりと浮かびあがる、夕暮れどきに鑑賞するのがおすすめです。, 米どころ秋田の郷土料理である「きりたんぽ鍋」は、つぶしたごはんを棒に巻き付けて焼いた「たんぽ」と土地の野菜やきのこ、鶏肉を煮込んだ料理です。同じく秋田名産の比内地鶏の出汁をたっぷり吸ったきりたんぽを、ぜひ召し上がってみてくださいね。, 秋田スギ, フキのとう, やまどり
06, 山形県, f679982a45ebfb995bfdb16b1b2cea965df8865878a4292dfa761b16e473c783, 01, 松尾芭蕉が「おくのほそ道」で詠んだ有名な一句 “閑さや岩にしみ入る蝉の声”がここで生まれたことは、山形県民の誇りです。\n山寺ではぜひ、名物の力こんにゃくを食べて、1015段の石段を登り、頂上で格別の景色を堪能してください。, 河原で友人や職場の仲間と芋煮を囲んで交流を深める「芋煮会」は、山形の秋の風物詩。とくに、馬見ヶ崎川河川敷で毎年行われている「日本一の芋煮会フェスティバル」は、直径6mの大鍋で作られた芋煮が振る舞われる秋の一大イベントです。, さくらんぼ, べにばな(紅花), オシドリ
07, 福島県, 2eee61351a28f9f676a1c1174949a542190f0e3fd86fc2dd75702d6464fda4f6, 01, 神秘的で威厳のある達沢不動滝は、福島出身の私が故郷を感じる、隠れた名所です。\n毎年、緑がひときわ濃く美しい夏から秋の季節に訪れ、癒しのひとときを過ごしています。, 豊かな自然が生み出す伏流水を使い、一般的なラーメンの麺よりも水分を多く含んだ、太めの平打ちちぢれ麺が特徴です。あっさりとした、香り高いしょうゆベースのスープが喜多方流。その香りだけで幸せな気持ちになります。, ケヤキ, ネモトシャクナゲ, キビタキ
08, 茨城県, c99f1df3923cf6da82d52da1d086f51c3dd517cb96e7ee1e89f91d00aec8fbd5, 02, 国内最大級の、歩いて渡れる橋・竜神大吊橋。四季折々の美しさがありますが、私のおすすめシーズンはゴールデンウィークです。その期間には、1000匹もの鯉のぼりが山あいを悠然と泳ぎ、幼少期に見てとても感動したことを覚えています。, 茨城といえば、納豆。「わら納豆」はよく知られていますが、切り干し大根が入った「味付き納豆」はご存知ない方も多いのではないでしょうか？　切り干し大根のカリカリした食感がごはんとの相性抜群です。納豆が苦手な方にもぜひお試しいただきたい一品です。, ウメ, バラ, ヒバリ
09, 栃木県, 5c985fccf4bbf5bc00d2b0907a68ba85e25a9c0424b4c9d4bc4ad1f1d5abaa50, 02, 大谷石の採掘の歴史が分かる資料館。見学可能な地下採掘場は、まるで別世界のように幻想的かつ神秘的です。私はときどき、少し現実を離れてリフレッシュしたいときに訪れ、エネルギーをチャージしています。, 餃子の街と言われる宇都宮には、約200もの餃子店があります。宇都宮餃子の特徴は野菜中心でお肉やニンニクが控えめなところ。薄皮のパリッとした食感と、野菜をたっぷり使った具の味わいは、一度食べればきっとやみつきになります。, トチノキ, やしおつつじ, オオルリ
10, 群馬県, 9d24894c37ab68beef0b4221c03f8bc911e1e3de009ae53116602baed6d1578f, 02, ぐんま天文台は、日本初の女性宇宙飛行士で、群馬県出身の向井千秋さんが宇宙に飛び立ったことを記念して建設されたとのこと。私の出身地でもあり、天文台から1時間ほどの距離にある「吾妻（あがつま）」も大変星が美しく、小学生のころに家の屋上から星の数を数えていたことを思い出します。, 蒸したまんじゅうを長めの竹串に刺してこんがりと焼き、甘辛い味噌ダレをたっぷりと塗ったのが群馬の「やきまんじゅう」。小腹が減ったときや、子どものおやつとしても重宝する、群馬県民が愛する名品です。, クロマツ, レンゲツツジ, ヤマドリ
11, 埼玉県, 14aeb24b3cae4bad2b53a4313f696a8cdc33f492d9c7462c7766ee92cf50b5ed, 02, じわじわと海外でもブームの兆しを見せている盆栽。ここは、日本屈指の盆栽郷として、外国人観光客も急増しています。本格的な盆栽文化を、肌で感じてみてはいかがでしょうか？, 日本一の川幅を有し、埼玉を流れる「荒川」に由来して名付けられたご当地グルメ「川幅うどん」。ボリューム満点でお腹も心も満足するうどんです。お店によって味付けやコシも異なるので、食べ歩きもおすすめですよ。, ケヤキ, サクラソウ, シラコバト
12, 千葉県, 31d5c25b46b0dbeafa40fbc6e3c01ca667b243d96dcee1ccad4362efa0a2198f, 02, 洞窟の穴から差し込む光と、それによってできる影がとても幻想的なスポット。朝早い時間帯には、差し込む光が水面に反射してハートのシルエットが浮かび、とてもロマンチック。千葉県の自然を満喫できるスポットです。, 日本の落花生の約8割が栽培される千葉県では、落花生(ピーナッツ)を使ったメニューのあるお店がたくさんあります。じつは、落花生は鮮度によって味が全然違うので、ぜひ専門店などでも召し上がってみて下さい。, マキ, なのはな, ホオジロ
13, 東京都, db5255ab6487ee2c00eda26ddc275746e8104d2466a523bc44f2ff02c0fa3dd2, 02, 世界有数の規模を誇る渋谷交差点は、なんと、一度の青信号で3000人もの人が通行することをご存知ですか？　  せわしなく歩いてしまいますが、やはり大都会東京の象徴的なアイコンです。世界各地から来た人が、その人の多さにシャッターを切る姿も目にします。, 甘味の定番「あんみつ」が、じつは東京発のご当地グルメであることをご存知ですか？　浅草のお店で誕生した「みつ豆」に、銀座のお店で餡をのせたのが「あんみつ」の始まりと言われているそうです。カラフルなあんみつは、インスタ映えする和風スイーツの代表格です。, イチョウ, ソメイヨシノ, ユリカモメ
14, 神奈川県, 2bd5ae7e872e419d03b233ee0153e914c386a0cdf1e44e1de13a4bb9516460f3, 02, 寺院が点在する鎌倉では、咲いている花の種類で季節の流れを感じます。なかでも、梅雨時期の紫陽花は有名です。雨が続く憂鬱な季節に、明月院の紫陽花は気分を明るくしてくれます。, 食べられる場所や時期も限られている、貴重な「生シラス」。新鮮な生シラスは甘みがあり、つるりとした食感が特徴です。漁師さん曰く、最もおいしい時期は春だそう。ふっくらとした食感の釜揚げシラスと食べ比べするのもおすすめです。, イチョウ, ヤマユリ, カモメ
15, 新潟県, 28dd32e02acbea0db4ba858374333569e2ca831ca81617acc16bf5a14773e903, 03, 古くから新潟の市民をつなぎ、主要な交通路とされてきた萬代橋。 新潟出身の私の故郷のイメージといえば、信濃川に架かる萬代橋の６つの美しいアーチが目に浮かびます。 季節や眺める場所によって、様々な表情を見せてくれるのも魅力です。, 布海苔（ふのり）という海藻をつなぎに使ったそばで、のどごしのよさと強いコシが特徴です。３～４人前のそばを「へぎ」と呼ばれる長方形の器に盛りつけ、家族や友達みんなで食べるのがご当地流です。, ユキツバキ, チューリップ, トキ
16, 富山県, 079ebf285570e3840c6853f8601227c77fce74a0945a3567fcd38ab1897d3435, 03, 公園内におしゃれなカフェや美術館な名所が点在し、富山県民から愛される憩いの場。\nまだまだ新しい施設ですが、地元に帰ると必ずここに立ち寄り、散歩やジョギングをしてリフレッシュしています。, 一般的にかまぼこと言えば板付きのものですが、富山のかまぼこは、昆布などで巻き上げられて伊達巻のような見た目をしています。また、鯛や鶴亀などに形作られたものは、婚礼の引出物に使われることもあり、おいしさと見た目の両方が楽しめる名産品です。, 立山杉, チューリップ, ライチョウ
17, 石川県, b8af9b9a7c3523e7dbc7abd02e1a9d1452d3ff4d542d6f1a3dbb592c9229e6db, 03, 日本の棚田百選や、日本初の世界農業遺産に認定された白米千枚田。冬のイルミネーションは圧巻の美しさです。使用するLED装置は、地元企業と協力してペットボトルを利用するなど、地域の活性化にも貢献しています。, 石川県にあるおでん屋さんの数は、なんと全国1位。石川のおでんは、魚介の出汁をベースに、海産物やお麩などの地元色豊かな具材がたっぷり入っています。とくに冬には香箱蟹を使用した「カニ面」という、カニの殻に身やミソなどを詰めたおでんが有名です。, あて, クロユリ, イヌワシ
18, 福井県, bd2e66f67c73b2f18733aa2aef7e147e3b763d8ca8ceaaaa0f843855f445362b, 03, 世界最大級の恐竜骨格や標本を鑑賞することができる博物館。小学生のときに初めて訪れ、いまにも動き出しそうな恐竜に大興奮したことを覚えています。老若男女問わず楽しめるので、幅広い年代におすすめです。, 福井県では、カツ丼といえばソースカツ丼が一般的で、ソースカツ丼は、福井県が発祥の地とも言われています。ボリュームたっぷりですが、衣が薄付きなので脂っこく感じません。ゲン担ぎに、ここぞという場面でいただくソウルフードです。, マツ, スイセン, ツグミ
19, 山梨県, a74ddf41720aff18c4464b5efffa58f185893fb3f6c6c516f23966098fb176c6, 03, 河口湖の周辺は美術館や様々な体験施設があり、散策にはもってこい。富士山の眺望も素晴らしく、ぐるりと一周し、違った表情の富士山をみるのも楽しみのひとつです。, 山梨の郷土料理といえば、味噌仕立てのスープに平打ちの太麺とかぼちゃなど季節の野菜がたっぷり入った「ほうとう」です。地元で採れた野菜のうまみが溶け込んだ味わい深いスープは絶品です。, かえで, ふじざくら, うぐいす
20, 長野県, b0d59ceb9cd979fb5fca996747086211da48259ed5953e2124cab992af017c74, 03, 松本のランドマークである、国宝・松本城は、シックな黒を基調とした天守が魅力。城の南側からの風景ではアルプスの山々を望むことができ、とくに、冬場は、雪化粧した白いアルプス山脈と漆黒の松本城とのコントラストが見事です。, 長野県のB級グルメとして有名な「山賊焼き」は、ジューシーな鶏モモ肉にニンニクや醤油などで下味をつけてカリッと揚げたもの。お酒のおつまみにも、ごはんのおかずとしてもぴったりな一品です。, しらかば, りんどう, 雷鳥
21, 岐阜県, b9a8ad1c9da217632e7de7ad2cfa2f059150c648c2a3e8099be3ce4434fe156b, 03, 大正時代の建物や雰囲気がそのまま残る、歴史好きにはたまらない日本大正村。ロマンあふれる大正時代の街を、当時の服装で散策することもできます。歴史ファンとしては、明智光秀ゆかりの地ということも見逃せないポイントです。, 2018年の朝ドラ『半分、青い』でも話題になった「五平餅」は岐阜県美濃地方のソウルフードです。タレのベースに、醤油と味噌のどちらを使うか、ゴマ・クルミ・エゴマの何を使うかは地域で違うので、好みの味を見つけてくださいね。, イチイ, れんげ, 雷鳥
22, 静岡県, f272d0ba399d28f88448fd98e063db21601fae9ce7b3024ac0b248238d61ce08, 03, のどかな風景が広がる大井川沿いを走る大井川鉄道は、昭和初期に製造されたSLが現役で運航中。レトロな車内から四季折々の風景を楽しむことができます。車窓から見える茶畑が、静岡ならではの情緒を感じることができます。, 生で食べるのもおいしい「桜えび」ですが、かき揚げで食べると更にその香りを楽しむことができます。毎年5月に静岡市で行われる「由比桜えびまつり」は、旬の桜えびを存分に楽しめるご当地イベントです。, もくせい, つつじ, さんこうちょう
23, 愛知県, eae117b621fed97797dfafff182d74efd61e8909ed1c5b61db059c3640a683b6, 03, じつは東京タワーよりも長い歴史を持つ名古屋テレビ塔。地元では名古屋のシンボルとして、市民に愛され続けています。\n2020年7月までは残念ながら工事中ですが、リニューアル後にぜひ訪れてください。, 喫茶店のモーニングと言えば「小倉トースト」。シンプルなメニューながら奥が深く、ホイップクリームがついていたり、パン生地が違ったりと、お店によってこだわりがあります。愛知にお越しの際にはお気に入りを探してみてください。, ハナノキ, カキツバタ, コノハズク
24, 三重県, 8558110543dd27e7c06baf68af93ad659cd725baf1685a6a65e1723433e7adcc, 04, 夫婦岩があるのは、縁結び・夫婦円満・交通安全などにご利益のある二見興玉神社。三重県のパワースポットのひとつでもあり、古くより伊勢神宮参拝の前には、ここで心身を清める習わしがあります。夕暮れ時には夫婦岩が黄昏のなかで一層神秘的に映ります。, 伊勢志摩は日本有数の「伊勢海老」と「蛤」の産地です。漁が解禁される秋から冬にかけて新鮮な海の幸が楽しめます。インパクトのある三重の伊勢海老は、グルメ写真映えすること間違いなしです。, 神宮スギ, ハナショウブ, シロチドリ
25, 滋賀県, f1f2550a7e0b8842e4827ff829b1d3d38b113b2104a78292ace98ee16229571e, 04, 毎年8月に開催される琵琶湖大花火大会。私が滋賀県で過ごした学生時代は、毎年のように友人と浴衣を着て出かけ、暑いなか屋台の行列に並んだり、湖面に映る幻想的な花火の情景を鑑賞したりと、思い出がたくさんある夏の風物詩です。, 昔は滋賀の保存食として食べられていた「鮒寿司」。地域によって少しずつ作り方の差があり、味も違います。一般の方でも参加できる「鮒寿司」の漬け込み講習会も開催されており、その食文化が受け継がれています。, 紅葉, 石楠花, かいつぶり
26, 京都府, 56f0d560ebc884d5acb567daa0eefe7007870c2275933a7fbc57a363357b47ff, 04, 日本三景のひとつであり、数千本の松の木が茂る細長い砂浜が全長3.6kmも続く景勝地です。 京都といえば、神社仏閣を訪れる方が多いかと思いますが、観光船やボート、サイクリングなど様々な楽しみ方がある天橋立にもぜひ足を延ばしてみてください。, 静岡茶・狭山茶と並ぶ、通称「日本三大茶」の一つが京都の「宇治茶」。老舗の茶店で点てたお茶をいただくのはもちろん、古民家を改装したカフェで宇治茶を使ったスイーツをいただくのも、京都を訪れる楽しみの一つです。, 北山杉, しだれ桜・嵯峨ぎく・なでしこ, オオミズナギドリ
27, 大阪府, 961adc8568a6d78da5b96adbb7a123b034d41f7ac355a6bfeac242d539df5902, 04, 誰もが一度は日本の歴史の教科書で見た仁徳天皇陵古墳を擁する百舌鳥・古市古墳群。国内最大級の前方後円墳は、太古の歴史と謎を秘めた、ロマンあふれる名所です。, お店ごとの秘伝のソースがあるのが大阪名物の「串カツ」。アツアツの串カツにソースをたっぷり染み込ませていただくのがたまりません。店選びに迷ったら、大阪らしく活気あふれる昔ながらのお店に入るのがおすすめです。でも、ソースは二度付け禁止なのでご注意を！, いちょう, さくらそう・うめ, もず
28, 兵庫県, b169ce7a3975e271a348347707f75ba25fd84e2e8aa9a154d09f914ccf852940, 04, 神戸市では、夜になると六甲山系の山肌に市章・イカリ・KOBEなどをモチーフにした電飾の灯かりがともります。この夜景は、国際的な港町の神戸らしい雰囲気が満点です。, たこ焼きとも似ていますが、卵がメインの生地に大ぶりのタコが入っていて、ソースではなくあっさり味の出汁につけて食べるのが「明石焼き」。発祥地の明石市では、全国に知られている明石焼きという呼び方ではなく「玉子焼き」と呼ばれています。食べると思わず笑顔になれる思い出の味です。, クスノキ, ノジギク, コウノトリ
29, 奈良県, df45bcb80154a8827a9db90c3dcd60ea493ca4d78c7754bc847a05d8e6434036, 04, 世界遺産である吉野山には、ソメイヨシノの原木であるシロヤマザクラと呼ばれる山桜を中心に約200種30000本の桜が密集しています。その息をのむほどの絶景は、「日本に生まれて良かった！」と改めて実感させてくれます。, 柿の葉には抗酸化作用や殺菌作用があり、保存食としても重宝されていた奈良名物「柿の葉寿司」。一晩ねかせて食べるとよりおいしいとも言われています。秋には色づいた柿の葉を使用したお寿司を販売するお店もあります。, すぎ, 奈良八重桜, こまどり
30, 和歌山県, 07daab6f59a5c5d5cb7b443986e6e7974298f7bdae5a17c46d12721f94cec6ab, 04, 和歌山県といえば、真っ白でサラサラの砂で有名な美しい白浜。そこで毎年開催されているのが砂まつり大会です。\n当日の日の出ごろから参加者が集い、海岸の白砂と海水で作品づくりをする体験型のコンクールでもあり、地元の名物イベントです。, 和歌山県は、梅の収穫量が全国で1位、国内収穫量のなんと6割以上を占めています（2018年）。梅の産地ならではの梅を使ったグルメやスイーツもたくさんあります。最近では和歌山の名産品の紀州梅と地鶏の両方を使用した「梅バーガー」なども見かけます。, ウバメガシ, ウメ, メジロ
31, 鳥取県, 0b71c7878bdf5dbc7ba4260b661bba2fdfb25b3bf4e38d4a662ecd85639b2ffa, 05, 平安時代の後期に建てられた投入堂は、 険しい修験道の先にある断崖絶壁に建つ荘厳な寺院。本来、修験道であったところにつくられたこのお寺は、国宝として長い歴史と伝説が語り継がれています。, 鳥取県は、日本有数の蟹の水揚げ量を誇り、境港周辺のお店ではお手頃価格で蟹料理を楽しむことができます。カニ足を出汁にさっとくぐらせていただくと、豊かな風味とほのかな甘みを感じられます。蟹のエキスたっぷりのお出汁で作った雑炊もまた格別です。, ダイセンキャラボク, 二十世紀梨の花, オシドリ
32, 島根県, 32d6e5226465fcbea752c2ba5c8885b949b8f71f9a5dc854496a2ecf6158669e, 05, 「稲佐の浜」は、神々が集うと言われている旧暦10月11日に全国の八百万の神を向かい入れる浜です。稲佐の浜には頂上に鳥居を構える不思議な島「弁天島」があり、地元では「べんてんさん」という愛称で親しまれているスポットです。, サバは、焼き魚や煮付け、酢でしめるなどして食べることが多いですが、島根ではその鮮度を活かしてしゃぶしゃぶでいただきます。お店によって出汁の味が違うので、お気に入りの出汁の味を探してみるのもおすすめです。, クロマツ, ボタン, ハクチョウ
33, 岡山県, c4caa2f55d2fd1aaeb80f954d26a50d5a529d408d9f010987aa090ada029baa8, 05, 倉敷川沿いの柳並木と蔵の白壁、昔ながらの町屋にレトロな洋館など、美しい街並みが続いて見飽きることのない倉敷美観地区。昼の散策も良いですが、ライトアップされた夜も情緒があっておすすめです。また、同地区にある日本最初の西洋美術館「大原美術館」の建築の美しさ、そして素晴らしいコレクションは一見の価値ありです。, B-1グランプリ（ご当地グルメの祭典）で全国1位を獲得したことがある「ひるぜん焼きそば」。濃厚な味噌ベースの甘辛ダレとかしわ肉、地元蒜山高原のキャベツを使っているのがポイント。お店によってタレの味付けが違うので食べ比べも楽しみの一つです。, あかまつ, ももの花, きじ
