34, 広島県, 26f2604f531759f10f2e9f634841be86390472edf3cd3692f9c91da04bd139ad, 05, 近年、アニメの舞台となったことでも注目された鞆の浦は、江戸時代の面影を残す歴史のある港町。当時を感じられる街並みがいまでも残っています。\nひな祭りの時期には、およそ1ヶ月もの期間「町並みひな祭」という行事が開催され、町屋や酒蔵など、市内のいたるところに代々受け継がれてきたひな人形が並びます。, 牡蠣の生産量全国1位の広島では、酢牡蠣に土手鍋、カキフライやお好み焼きなど、牡蠣を使ったグルメが豊富に楽しめます。牡蠣がおいしくなる1月中旬から2月頃には、各地でフードイベントが行われ、この時期に合わせて広島を訪れる旅行者も多いそうです。, モミジ, モミジ, アビ
35, 山口県, c86fd25ed44756753cc88a71f69156bb4c5194ff900c3f7b27aa2431f5e75704, 05, 2000年に開通した、山口県下関市と豊北町角をつなぐ角島大橋。 まるで異国のリゾート地のようなエメラルドグリーンに輝く海と、真っ青な空を橋から見渡すことができます。現地で食べられる、地元の海女さんがとったサザエの壺焼きもおすすめです。とくに、お天気が良い日の観光は最高ですよ。, 茶そばを瓦の上にのせて焼き、温かいつゆで食べる、という変わった食べ方をしますが、その味は抜群です。茶そばを焼くことでお茶の香りが立ち、上品なつゆとよく合います。家では瓦のかわりにホットプレートを使って熱々をいただきます。, アカマツ, 夏みかんの花, ナベヅル
36, 徳島県, ff56be65e793b763c155ed6dd0a5a39717e3d14617ae7e4123218b6edc57d579, 05, いまでも手付かずの自然が残る日本有数の秘境のひとつ。四季折々の表情を楽しめるうえに、野生のシラクチカズラという植物で編まれたつり橋を渡ることもできる、スリル満点の絶景スポットです。, 徳島ラーメンはスープの味が濃く、やや強めの甘味が特徴。まるですき焼きのような感覚で、甘辛いラーメンをごはんのおかずとして食べる人も多いです。茶系・白系・黄系の3系統あり、3種を食べ比べて楽しめるのも魅力のひとつです。, やまもも, すだちの花, しらさぎ
37, 香川県, 6cc56d7f2b27b1501b066a769b413360078baf9ea5fc6ca0199804f8dd261b5e, 05, 干潮時の美しさは、南米・ボリビアのウユニ塩湖の水鏡のような光景だと話題のスポット。夕暮れ時には空のグラデーションが水面に映り、自然の織りなすコントラストの美しさに何度訪れても心打たれる場所です。「日本の夕陽百選」にも選ばれています。, 約900件ものうどん屋が軒を連ね、「うどん県」という別名も知られている香川県。お店によって食べ方もバラエティに富んでいます。わたしのおすすめは、さぬきうどん本来の美味しさを存分に味わえる「冷しぶっかけ」です。, オリーブ, オリーブ, ホトトギス
38, 愛媛県, eabd4f1410a8198a8ebb6a391269aad5daf844f7431bef51bf1d43bb42834f0f, 05, 3000年もの歴史を持つ日本最古の温泉といえば道後温泉。日本書紀や源氏物語にも登場し、聖徳太子も入ったといわれています。入浴後にはレンタルも可能な浴衣を着て、商店街「道後ハイカラ通り」のレトロな雰囲気を楽しむのもおすすめです。, 郷土料理「鯛めし」は地域によって食べ方が違います。松山市を中心とした地域では、タレに漬けたお刺身をごはんにのせる食べ方をしますが、宇和島市を中心にした地域では鯛一匹をまるごと炊き込んだ鯛めしが一般的。味や見た目の違いをぜひ楽しんでください。, まつ, みかんの花, こまどり
39, 高知県, 7e9e0495cf69b5e01f1bb43de5250bd84bba0cb6ed95629ba9f2bda32bb8e9fe, 05, 四万十川流域の沈下橋とその周辺の景観は、文化庁により「重要文化的景観」に認定されています。太陽の光や季節により見え方が変わる四万十川と清流に溶け込む沈下橋の景色が楽しめます。, 漁場の黒潮に近い高知県は日本有数のカツオ産地で、消費量も日本一。春の初ガツオと秋の戻りガツオはとくに美味しく、本場の高知で味わっていただきたい自慢の一品です。, ヤナセスギ, ヤマモモ, ヤイロチョウ
40, 福岡県, 13ad48410ce703d2e232919bd455a72ccf94bdbb9e4df01d3410a5276d69ba3b, 06, かつての城下町らしく、街全体を「お堀」がぐるりと取り囲み、小京都のような美しい風景が残る街。お堀の周りを歩きながら散策するのも楽しいですが、舟旅もまた情緒があるのでおすすめです。柳川の季節の花々を見ると、日本の四季の素晴らしさを実感します。, ごはんのお供はもちろん、パスタやチャーハン、パンに挟んだりすることも。和洋のグルメに何でも合う明太子は、贈答の品としても喜ばれる福岡自慢のグルメです。, つつじ, うめ, うぐいす
41, 佐賀県, f093298210d8da83285d5f2743f55797b86cd2b4a2548c70ffb1b854e23f8890, 06, 静岡県・三保の松原と福井県・気比の松原と並ぶ日本三大松原のなかで唯一の特別名勝に指定されています。虹の松原には、二本の幹の間を通ると幸せになれると言われているパワースポットもあります。, 「シシリアンライス」はあまり全国に知られていませんが、ごはんの上に甘辛いタレで炒めたお肉と生野菜を盛り付け、仕上げにマヨネーズをかけたご当地グルメです。佐賀では学校の給食にも採用され、野菜嫌いな子ども達にも大人気のメニューです。, クス, クスの花, カササギ
42, 長崎県, 573ad9d0132573a09be2c26c7b81e87d4106f48bf5c3fe349204de8575f375cf, 06, 佐世保市の「九十九島（くじゅうくしま）」は数え切れないほど島がたくさんあるという意味から名づけられたのが由来だそう。「九十九島八景」と呼ばれる、市内に点在する展望台から臨む夕陽は格別です。, アメリカ文化の影響を大きく受けた「佐世保バーガー」は、ボリューミーで食べごたえ満点。お店によってバーガーの特徴が違うので、食べ比べを楽しんでみてはいかがでしょうか。, ヒノキ・ツバキ, 雲仙ツツジ, オシドリ
43, 熊本県, 43e314f984507626c060952f481acb738180f9ce116758ca9519427aef277aa6, 06, 熊本を代表する阿蘇の癒しスポット。夏は青々とした木々の間から差し込む光が美しく、冬は滝を流れる流水が凍って幻想的な氷柱となり、季節によって異なる表情が見られます。春の鍋ヶ滝はライトアップされ、非日常の空間です。また、滝の裏側が見学できるのも魅力です。, レンコンのなかに辛子味噌がギュッと詰まった、揚げたての衣との相性がクセになる熊本の郷土料理です。辛味だけでなく旨味も詰まっていて、マヨネーズをつけるとよりマイルドになるので辛味が苦手な方でもおいしくいただけます。チーズをのせて焼いてもおいしいですよ。, クスノキ, リンドウ, ヒバリ
44, 大分県, 7d40c68fb2a1c3eb51eac6e054125d647ea8869dfd5244450d0d25b776fcac59, 06, 朱色の美しい御殿と、多くの木々に囲まれた広大な境内を誇る宇佐神宮。由緒ある神社でありながら、大分を代表する縁結びなどのパワースポットとしても有名です。\n風情たっぷりの紅葉が見られる秋、そして新緑のさわやかな初夏に訪れるのがおすすめです。, 「とり天」は、甘辛い味付けと鶏肉のコクがたまらない大分の吉野地区の郷土料理です。天つゆや名産のカボスを絞って食べる方も多いですが、揚げたてを酢醤油で食べるのもおすすめの食べ方です。, 豊後梅, 豊後梅, めじろ
45, 宮崎県, 87bc39317bafda190147af072cfff9369198a06e0e469d9dc039a4714eebbc8b, 06, イースター島のモアイ像を日本人が修復したことがきっかけで、宮崎県にもモアイ像が建てられました。   海を背にずらっと並ぶモアイ像は一見の価値ありです。7体のモアイ像にはそれぞれ仕事運や恋愛運などのジンクスがあると言われているので、チェックしてみてはいかがでしょうか？, 自然のなかでのびのびと育った地鶏を炭火で香ばしく焼き、柚子胡椒をつけて食べます。専門店や居酒屋で食べられるだけでなく、スーパーの駐車場の一角で露店販売もされており、食卓にも並ぶ小さい頃から馴染みのある料理です。, フェニックス, はまゆう, コシジロヤマドリ
46, 鹿児島県, a610b99bff3272e034aec28ca68fc726bb298ece4117bf356a3296ddd787126a, 06, 青い海と白い砂浜に囲まれた種子島宇宙センターは、世界一美しいロケット発射場と言われています。 ロケットの打ち上げ時には多くの宇宙ファンが訪れ、その日は島がとてもにぎやかです。, 「きびなご」は鹿児島県本土や甑島、種子島などの近海で一年を通じて水揚げされる青魚の一種です。旬は産卵期を迎える春から初夏ですが、冬のきびなごも身が締まり旬の時期とは違ったおいしさが楽しめます。, クスノキ・カイコウズ, ミヤマキリシマ, ルリカケス
47, 沖縄県, 0243c04479bb2705239afa4eac6c93753ed4bdbf999798df5ab02c734fabf06e, 06, 丘の上に建つ勝連城跡は、沖縄有数の景勝地。下から眺めると自然の地形が巧みに活かされていることがわかり、石垣が青い空に映えとても綺麗です。近くには海中道路もあるのでドライブコースとしてもおすすめです。, 全世代に愛されている沖縄の代表的なソウルフードです。うちなーんちゅ（沖縄県民）は大みそかの年越しそばにも、あっさりとして出汁のきいた「沖縄そば」を食べる家庭がほとんどです。, リュウキュウマツ, デイゴ, ノグチゲラ'